,iyear,imonth,iday,country_txt,region_txt,city,latitude,longitude,summary,doubtterr,multiple,success,suicide,attacktype1_txt,attacktype2_txt,attacktype3_txt,targtype1_txt,corp1,target1,natlty1_txt,targtype2_txt,corp2,target2,natlty2_txt,targtype3_txt,corp3,target3,natlty3_txt,gname,gname2,gname3,motive,individual,nperps,nperpcap,claim2,claim3,weaptype1_txt,weaptype2_txt,weaptype3_txt,weaptype4_txt,weapdetail,nkill,nkillter,nwound,nwoundte,property,propextent,propextent_txt,propvalue,propcomment,ishostkid,nhostkid,nhours,ndays,ransom,ransomamt,ransompaid,ransomnote,hostkidoutcome_txt,nreleased,,
147023,2015,4,20,Iraq,Middle East & North Africa,Husseiniyah,33.548306,44.415733,"04/20/2015: An explosive device detonated in Husseiniyah area, Diyala, Iraq. At least one person was killed and four were injured in the blast. The Islamic State of Iraq and the Levant (ISIL) claimed responsibility for the incident.",0,0,1,0,Bombing/Explosion,,,Private Citizens & Property,Not Applicable,Civilians,Iraq,,,,,,,,,Islamic State of Iraq and the Levant (ISIL),,,,0,-99,0,NA,NA,Explosives,,,,,1,0,4,0,0,NA,,NA,,0,NA,NA,NA,NA,NA,NA,,,NA,,
146558,2015,4,8,United Kingdom,Western Europe,Larne,54.856471,-5.810265,"04/08/2015: Assailants threw incendiary devices at a private residence in Larne, Northern Ireland, United Kingdom. There were no reported casualties in the attack. No group claimed responsibility for the incident.",0,0,1,0,Facility/Infrastructure Attack,,,Private Citizens & Property,Not Applicable,House,Northern Ireland,,,,,,,,,Unknown,,,,0,2,2,NA,NA,Incendiary,,,,Petrol bombs were used in the attack.,0,0,0,0,1,3,Minor (likely < $1 million),-99,A house was damaged in this attack.,0,NA,NA,NA,NA,NA,NA,,,NA,,
4070,1976,8,14,Italy,Western Europe,La Maddalena,41.214436,9.407588,,0,1,1,0,Bombing/Explosion,,,Military,,"U.S. vehicles, personally owned by Navy personnel",United States,,,,,,,,,Baader-Meinhof Group,,,,0,NA,NA,NA,NA,Incendiary,,,,Incendiary,0,NA,0,NA,1,3,Minor (likely < $1 million),51000,,0,NA,NA,NA,0,NA,NA,,,NA,,
95889,2010,3,28,Iraq,Middle East & North Africa,Baqubah,33.74324,44.623825,"03/28/2010: On Sunday evening, in the Al Qatun district of western Ba'qubah, Diyala, Iraq, assailants detonated an improvised explosive device near the district mayor's house, damaging the house but causing no casualties. As police first responders arrived, assailants detonated a second IED, wounding seven police officers. No group claimed responsibility.",0,0,1,0,Bombing/Explosion,,,Government (General),Al Qatun District Government,The target was the district mayor's house.,Iraq,Police,Al Qatun Law Enforcement,The target was police first responders.,Iraq,,,,,Unknown,,,The specific motive for the attack is unknown.,0,-99,0,NA,NA,Explosives,,,,Two improvised explosive devices were used in the attack.,0,0,7,0,1,3,Minor (likely < $1 million),NA,A house was damaged in the attack.,0,NA,NA,NA,NA,NA,NA,,,NA,,
161237,2016,4,16,Iraq,Middle East & North Africa,Baghdad,33.303566,44.371773,"04/16/2016: An explosive device detonated near a market in Al-Bakriyah, Baghdad, Iraq. At least two people were killed and eight people were injured in the blast. No group claimed responsibility for the incident.",0,0,1,0,Bombing/Explosion,,,Private Citizens & Property,Unknown,Market,Iraq,,,,,,,,,Unknown,,,,0,-99,0,NA,NA,Explosives,,,,,2,0,8,0,-9,NA,,NA,It is unknown if any property was damaged in this attack.,0,NA,NA,NA,NA,NA,NA,,,NA,,
123246,2013,11,10,India,South Asia,South Garo Hills district,25.330097,90.563609,"11/10/2013: Assailants abducted coal exporter Janking Marak from his residence in the South Garo Hills district, Meghalaya state, India. He was rescued by the Border Security Force (BSF) on November 13, 2013. No group claimed responsibility for the incident; however, BSF troopers identified Marak's kidnappers as members of the Garo National Liberation Army.",0,0,1,0,Hostage Taking (Kidnapping),,,Business,Unknown,Coal Exporter: Janking Marak,India,,,,,,,,,Garo National Liberation Army,,,"The specific motive is unknown; however, sources noted that the victim had received extortion notes from Garo National Liberation Army in the past.",0,4,0,NA,NA,Unknown,,,,,0,0,0,0,0,NA,,NA,,1,1,NA,3,0,NA,NA,,Successful Rescue,1,,
52028,1992,7,4,Algeria,Middle East & North Africa,Oran,35.696944,-0.633056,,0,0,1,0,Bombing/Explosion,,,Journalists & Media,Al-Jumhuriyah Newspaper,Headquarters,Algeria,,,,,,,,,Muslim Militants,,,,0,NA,NA,NA,NA,Explosives,,,,Explosive,0,NA,0,NA,1,NA,,NA,,0,NA,NA,NA,0,NA,NA,,,NA,,
35252,1988,7,29,Sri Lanka,South Asia,Trincomalee,8.577826,81.218719,,0,0,1,0,Bombing/Explosion,,,Transportation,Sri Lanka Transport Board,Bus,Sri Lanka,,,,,,,,,Liberation Tigers of Tamil Eelam (LTTE),,,,0,NA,NA,NA,NA,Firearms,Explosives,,,Automatic firearm, Grenade,2,NA,0,NA,1,NA,,NA,,0,NA,NA,NA,0,NA,NA,,,NA,
150039,2015,6,30,Colombia,South America,Saravena district,6.956107,-71.872595,"06/30/2015: An explosive device detonated targeting the Bicentenary oil pipeline in Brisas de El Bojaba area, Saravena municipality, Arauca department, Colombia. This was one of three explosions on the pipeline on the same day. No casualties were reported in the blast. No group claimed responsibility; however, sources attributed the incident to the National Liberation Army of Colombia (ELN).",0,1,1,0,Bombing/Explosion,,,Utilities,Bicentennial Oil Pipeline (BOC),Oil Pipeline,Colombia,,,,,,,,,National Liberation Army of Colombia (ELN),,,,0,-99,0,NA,NA,Explosives,,,,,0,0,0,0,0,NA,,NA,,0,NA,NA,NA,NA,NA,NA,,,NA,,
107122,2012,4,19,Pakistan,South Asia,Nawagai,34.404932,72.558932,"04/19/2012: A remote-controlled explosive device detonated at the Government School for Boys in Nawagai town, Federally Administered Tribal Areas, Pakistan. No casualties were reported; however, the building was destroyed. No group claimed responsibility for the incident.",0,0,1,0,Bombing/Explosion,,,Educational Institution,Government of Pakistan,Boys' Primary School,Pakistan,,,,,,,,,Unknown,,,,0,-99,0,NA,NA,Explosives,,,,,0,0,0,0,1,3,Minor (likely < $1 million),-99,The government school was damaged in this attack.,0,NA,NA,NA,NA,NA,NA,,,NA,,
96386,2010,5,8,Somalia,Sub-Saharan Africa,El Barde,4.827732,43.660667,"05/08/2010: On Saturday, in Ceel Barde near Xuddur, Bakool, Somalia, unknown assailants attacked the town by unknown means and took control of it; no casualties or damages were reported. No group claimed responsibility, but the militant group al-Shabaab is thought to be responsible for the attack.",0,0,0,0,Unknown,,,Private Citizens & Property,,The town of Ceel Barde was targeted in the attack.,Somalia,,,,,,,,,Al-Shabaab,,,The specific motive for the attack is unknown.,0,-99,0,NA,NA,Unknown,,,,Unknown weapons were used in the attack.,0,0,0,0,0,NA,,NA,,0,NA,NA,NA,NA,NA,NA,,,NA,,
36260,1988,11,18,Colombia,South America,Puerto La Esperanza,3.299682,-73.432754,,0,0,1,0,Assassination,,,Government (General),Patriotic Union Party,Felix Antonio Villalba Sanabria,Colombia,,,,,,,,,Death Squad,,,,0,NA,NA,NA,NA,Firearms,,,,Automatic firearm,0,NA,0,NA,0,NA,,NA,,0,NA,NA,NA,0,NA,NA,,,NA,,
35373,1988,8,13,Spain,Western Europe,Solares,43.38377,-3.738101,,0,0,1,0,Bombing/Explosion,,,Business,Auto showroom,Auto Showroom,France,,,,,,,,,Basque Fatherland and Freedom (ETA),,,,0,NA,NA,NA,NA,Explosives,,,,Explosive,0,NA,0,NA,1,NA,,NA,,0,NA,NA,NA,0,NA,NA,,,NA,,
94074,2009,10,22,Philippines,Southeast Asia,Taung,6.074574,121.134326,"10/22/2009: On Thursday night at 2300, in Taung village in Patikul, Sulu, Philippines, assailants detonated an improvised explosive device on the Tangan-Tangan Bridge, damaging the bridge but causing no casualties. No group claimed responsibility, although authorities suspected that the Abu Sayyaf Group (ASG) was responsible.",0,0,1,0,Bombing/Explosion,,,Transportation,,A bridge was targeted in the attack.,Philippines,,,,,,,,,Abu Sayyaf Group (ASG),,,The specific motive for the attack is unknown.,0,-99,0,NA,NA,Explosives,,,,An improvised explosive device was used in the attack.,0,0,0,0,1,3,Minor (likely < $1 million),NA,A bridge was damaged in the attack.,0,NA,NA,NA,NA,NA,NA,,,NA,,
22079,1984,5,16,South Africa,Sub-Saharan Africa,Jabulani,-26.252697,27.870275,,0,0,1,0,Bombing/Explosion,,,Police,,South African Police,South Africa,,,,,,,,,African National Congress (South Africa),,,,0,NA,NA,NA,NA,Explosives,,,,Explosive,0,NA,0,NA,1,NA,,NA,,0,NA,NA,NA,0,NA,NA,,,NA,,
2208,1974,1,30,United Kingdom,Western Europe,Belfast,54.607712,-5.95621,,0,0,1,0,Assassination,,,Private Citizens & Property,,"Thomas Walker, Protestant",Northern Ireland,,,,,,,,,Protestant extremists,,,,0,NA,NA,NA,NA,Firearms,,,,Firearm,1,NA,NA,NA,0,NA,,NA,,0,NA,NA,NA,0,NA,NA,,,NA,,
43875,1990,9,3,Bangladesh,South Asia,Unknown,NA,NA,,0,0,1,0,Assassination,,,Government (General),,Forest Service Employes,Bangladesh,,,,,,,,,Shanti Bahini - Peace Force,,,,0,NA,NA,NA,NA,Firearms,,,,Automatic firearm,2,NA,0,NA,0,NA,,NA,,0,NA,NA,NA,0,NA,NA,,,NA,,
151657,2015,8,10,Turkey,Middle East & North Africa,Cukurca,37.24705,43.611573,"08/10/2015: Assailants abducted 10 customs officials in Cukurca area, Yuksekova district, Hakkari province, Turkey. All of the hostages were released on September 8, 2015. The Kurdistan Workers' Party (PKK) claimed responsibility for the incident.",0,0,1,0,Hostage Taking (Kidnapping),,,Government (General),Turkish Ministry of Customs and Trade,Customs Officials,Turkey,,,,,,,,,Kurdistan Workers' Party (PKK),,,,0,-99,0,NA,NA,Unknown,,,,,0,0,0,0,0,NA,,NA,,1,10,NA,29,0,NA,NA,,Hostage(s) released by perpetrators,10,,
115183,2013,3,15,Afghanistan,South Asia,Ghazni,33.542622,68.415329,"03/15/2013: Gunmen shot and killed two police officers in the Deh Khudadad area of Ghazni City, Ghazni province, Afghanistan. A spokesperson for the Taliban claimed responsibility for the attack in a conversation with local media.",0,0,1,0,Armed Assault,,,Police,Afghan Police,Officers,Afghanistan,,,,,,,,,Taliban,,,,0,-99,0,NA,NA,Firearms,,,,,2,0,0,0,0,NA,,NA,,0,NA,NA,NA,NA,NA,NA,,,NA,,
40764,1989,11,29,Sri Lanka,South Asia,Hambantota,6.130655,81.1262,,-9,0,1,0,Armed Assault,,,Business,Businessman,"Residence, K.G. Ariyapala",Sri Lanka,,,,,,,,,Unknown,,,,0,NA,NA,NA,NA,Firearms,,,,Automatic firearm,2,NA,3,NA,1,NA,,NA,,0,NA,NA,NA,0,NA,NA,,,NA,,
181302,2017,12,14,Iraq,Middle East & North Africa,Muqdadiyah,33.953167,44.921906,"12/14/2017: A roadside bomb detonated against a farmer's vehicle in southern Muqdadiyah, Diyala, Iraq. The farmer was injured in the blast. No group claimed responsibility for the incident.",0,0,1,0,Bombing/Explosion,,,Private Citizens & Property,Not Applicable,Vehicle of Farmer,Iraq,,,,,,,,,Unknown,,,,0,-99,0,NA,NA,Explosives,,,,A roadside bomb was used in the attack.,0,0,1,0,1,3,Minor (likely < $1 million),-99,A vehicle was damaged in this attack.,0,NA,NA,NA,NA,NA,NA,,,NA,,
32131,1987,9,13,Peru,South America,Chuquibambilla,-14.102594,-72.706655,,0,0,1,0,Armed Assault,,,Private Citizens & Property,govt,town of Chuquibambilla,Peru,,,,,,,,,Shining Path (SL),,,,0,200,NA,NA,NA,Firearms,,,,Automatic firearm,3,NA,4,NA,1,NA,,NA,,0,NA,NA,NA,0,NA,NA,,,NA,,
87827,2008,7,9,Iraq,Middle East & North Africa,Fallujah,33.349159,43.784199,"07/09/2008: On Wednesday morning at 600, an improvised explosive device exploded near Al Abid bank in downtown Fallujah killing one guard and inuring three others. No claim of responsibility has been reported.",0,1,1,0,Bombing/Explosion,,,Business,Al Abid Bank,The Al  Abid bank in downtown Fallujah,Iraq,,,,,,,,,Unknown,,,The specific motive for the attack is unknown.,0,-99,0,NA,NA,Explosives,,,,An improvised explosive device was used in the attack.,1,0,3,0,-9,NA,,NA,It is unknown if damage was caused by the incident.,0,NA,NA,NA,NA,NA,NA,,,NA,,
46022,1991,4,4,Kuwait,Middle East & North Africa,Kuwait,29.347702,47.94912,,-9,0,1,0,Armed Assault,,,Police,Police,Unit,Kuwait,,,,,,,,,Palestinians,,,,0,NA,NA,NA,NA,Firearms,,,,Automatic firearm,0,NA,0,NA,1,NA,,NA,,0,NA,NA,NA,0,NA,NA,,,NA,,
96806,2010,6,6,Iraq,Middle East & North Africa,Baghdad,33.303566,44.371773,"06/06/2010: On Sunday, in the Mahmoudiyah district of Baghdad, Baghdad province, Iraq, unidentified militants detonated an improvised explosive device at the city hall, wounding eight of the local government employees, including the head of the city council. The blast hit a crowd of the city hall employees as they were heading to work in front of the building which was also damaged by the blast. No group has claimed responsibility for the attack.",0,0,1,0,Bombing/Explosion,,,Government (General),Baghdad Government,Government employees,Iraq,,,,,,,,,Unknown,,,The specific motive for the attack is to intimidate Baghdad government.,0,-99,0,NA,NA,Explosives,,,,An improvised explosive device was used in the attack.,0,0,8,0,1,3,Minor (likely < $1 million),NA,The attack caused a minor amount of property damage.,0,NA,NA,NA,NA,NA,NA,,,NA,,
175549,2017,6,4,Iraq,Middle East & North Africa,Mosul,36.354145,43.14357,"06/04/2017: Assailants attacked Old City neighborhood in Mosul, Iraq. Security forces repelled the assault, killing an unknown number of assailants. No group claimed responsibility; however, sources attributed the incident to the Islamic State of Iraq and the Levant (ISIL).",0,0,0,0,Unknown,,,Private Citizens & Property,Old City District,District,Iraq,,,,,,,,,Islamic State of Iraq and the Levant (ISIL),,,,0,-99,0,NA,NA,Unknown,,,,,NA,NA,0,0,0,NA,,NA,,0,NA,NA,NA,NA,NA,NA,,,NA,,
35714,1988,9,23,West Germany (FRG),Western Europe,Neustadt an der Weinstrasse,49.35027,8.137919,,1,0,1,0,Armed Assault,,,Military,German Army,Communications Installation,West Germany (FRG),,,,,,,,,Unknown,,,,0,NA,NA,NA,NA,Firearms,,,,Pistol,0,NA,0,NA,1,NA,,NA,,0,NA,NA,NA,0,NA,NA,,,NA,,
159054,2016,2,17,Saudi Arabia,Middle East & North Africa,Unknown,NA,NA,"02/00/2016: Sometime between February 14, 2016 and February 20, 2016, assailants opened fire on security personnel at an unknown location along the Yemeni border in Saudi Arabia. At least ten soldiers were killed in the attack. No group claimed responsibility for the incident.",1,0,1,0,Armed Assault,,,Military,Royal Saudi Arabian Armed Forces,Soldiers,Saudi Arabia,,,,,,,,,Unknown,,,,0,-99,0,NA,NA,Firearms,,,,,10,0,NA,0,0,NA,,NA,,0,NA,NA,NA,NA,NA,NA,,,NA,,
14932,1981,12,4,El Salvador,Central America & Caribbean,Unknown,NA,NA,,1,0,1,0,Bombing/Explosion,,,Military,,Military Vehicle,El Salvador,,,,,,,,,Unknown,,,,0,NA,NA,NA,NA,Explosives,,,,Claymore mine,0,NA,8,NA,1,3,Minor (likely < $1 million),10000,,0,NA,NA,NA,0,NA,NA,,,NA,,
68810,1999,4,18,Cambodia,Southeast Asia,Prek Phneou,NA,NA,"04/18/1999: In Cambodia, an attempt to blow up Khmer Society of Import-Export�s (SOKIMEX) Prek Phneou oil depot was averted and the five people involved were arrested. The perpetrator group was identified as the CSS Movement in one of the sources.",0,0,0,0,Facility/Infrastructure Attack,,,Business,Khmer Society of Import-Export (SOKIMEX),Khmer Society of Import-Export�s (SOKIMEX) oil depot near Prek Phneou,Cambodia,,,,,,,,,CSS Movement,,,Unknown,0,5,5,NA,NA,Firearms,,,,,0,0,0,0,0,NA,,NA,,0,NA,NA,NA,NA,NA,NA,,,NA,,
180339,2017,11,9,Somalia,Sub-Saharan Africa,Mogadishu,2.059819,45.326115,"11/09/2017: An explosive device detonated targeting a military vehicle in Hodan neighborhood, Mogadishu, Somalia. Three civilians were injured in the blast. No group claimed responsibility for the incident.",0,0,1,0,Bombing/Explosion,,,Military,Somali Armed Forces (SAF),Vehicle,Somalia,Private Citizens & Property,Not Applicable,Vehicle,Somalia,,,,,Unknown,,,,0,-99,0,NA,NA,Explosives,,,,A roadside bomb was used in the attack.,0,0,3,0,1,3,Minor (likely < $1 million),-99,A vehicle was damaged in this attack.,0,NA,NA,NA,NA,NA,NA,,,NA,,
148086,2015,5,14,Thailand,Southeast Asia,Yala,6.545499,101.2799,"05/14/2015: An explosive device detonated at a market in Yala city, Yala province, Thailand. This was one of 23 related bombings in Muang on this date and a string of bombings over three days in which 36 explosive devices were detonated throughout the district. At least 20 people were injured across the bombings on Thursday, May 14, 2015. No group claimed responsibility for the incidents; however, security officials attributed the attacks to Runda Kumpulan Kecil (RKK).",0,1,1,0,Bombing/Explosion,,,Private Citizens & Property,Muang Mai Market,Market,Thailand,,,,,,,,,Runda Kumpulan Kecil (RKK),,,,0,-99,0,NA,NA,Explosives,,,,,0,0,0,0,-9,NA,,NA,It is unknown if any property was damaged in this attack.,0,NA,NA,NA,NA,NA,NA,,,NA,,
24922,1985,5,3,France,Western Europe,Unknown,41.918891,8.737554,,0,1,1,0,Bombing/Explosion,,,Private Citizens & Property,Property of people from mainland France,,France,,,,,,,,,Corsican National Liberation Front (FLNC),,,,0,NA,NA,NA,NA,Explosives,,,,Explosive,0,NA,0,NA,1,NA,,NA,,0,NA,NA,NA,0,NA,NA,,,NA,,
2586,1974,10,8,West Germany (FRG),Western Europe,Frankfurt,50.11797,8.644191,,-9,0,0,0,Facility/Infrastructure Attack,,,Business,,Avis rental cars,United States,,,,,,,,,Unknown,,,,0,NA,NA,NA,NA,Incendiary,,,,Incendiary,0,NA,0,NA,0,NA,,NA,"Damages: none, attack unsuccessful (rental car company)",0,NA,NA,NA,0,NA,NA,,,NA,,
150427,2015,7,10,Nigeria,Sub-Saharan Africa,Ngamdu,11.763937,12.263129,"07/10/2015: Assailants attacked residents in Ngamdu village, Yobe, Nigeria. At least 11 people were killed and the village was set on fire during the raid. This was one of two coordinated attacks carried out the by same group overnight. No group claimed responsibility for the incidents; however, sources attributed the attacks to Boko Haram.",0,1,1,0,Armed Assault,Facility/Infrastructure Attack,,Private Citizens & Property,Ngamdu Village,Village,Nigeria,,,,,,,,,Boko Haram,,,,0,-99,0,NA,NA,Firearms,Incendiary,,,,11,0,NA,0,0,NA,,NA,,0,NA,NA,NA,NA,NA,NA,,,NA,,
32941,1987,12,14,El Salvador,Central America & Caribbean,Tejutla,14.169631,-89.102686,,0,0,1,0,Armed Assault,,,Private Citizens & Property,Govt,Town of Tejutla,El Salvador,,,,,,,,,Farabundo Marti National Liberation Front (FMLN),,,,0,NA,NA,NA,NA,Firearms,,,,Automatic firearm,0,NA,0,NA,1,NA,,NA,,0,NA,NA,NA,0,NA,NA,,,NA,,
16797,1982,8,12,France,Western Europe,Paris,48.856644,2.34233,,-9,0,0,0,Assassination,,,Police,offices of the Turkish Tourism Attache,policeman,Turkey,,,,,,,,,Terrorists,,,,0,NA,NA,NA,NA,Firearms,,,,Firearm,0,NA,0,NA,0,NA,,NA,,0,NA,NA,NA,0,NA,NA,,,NA,,
4907,1977,6,15,Spain,Western Europe,Sevilla,37.38264,-5.996295,,0,0,0,0,Bombing/Explosion,,,Utilities,,"Transformer, Seville Electric co.",Spain,,,,,,,,,First of October Antifascist Resistance Group (GRAPO),,,,0,NA,NA,NA,NA,Explosives,,,,Explosive,0,0,0,0,0,NA,,NA,,0,NA,NA,NA,0,NA,NA,,,NA,,
123978,2013,11,27,Iraq,Middle East & North Africa,Hadhar,35.656355,42.948453,"11/27/2013: An explosive device attached to a taxi detonated in Hadhar area, Nineveh governorate, Iraq. At least one person, the driver, was killed in the blast. No group claimed responsibility for the incident.",0,0,1,0,Bombing/Explosion,,,Transportation,Unknown,Taxi,Iraq,,,,,,,,,Unknown,,,,0,-99,0,NA,NA,Explosives,,,,A bomb attached to a taxi was used in the attack.,1,0,0,0,1,3,Minor (likely < $1 million),-99,A vehicle was damaged in this attack.,0,NA,NA,NA,NA,NA,NA,,,NA,,
52760,1992,8,30,Kuwait,Middle East & North Africa,Unknown,29.834446,47.154053,,0,0,1,0,Armed Assault,,,Police,Security Force,Unit,Kuwait,,,,,,,,,Unknown,,,,0,21,NA,NA,NA,Firearms,,,,Automatic firearm,1,NA,1,NA,1,NA,,NA,,0,NA,NA,NA,0,NA,NA,,,NA,,
43998,1990,9,11,Peru,South America,Huancayo district,-12.068306,-75.210163,,0,0,1,0,Assassination,,,Government (General),Govt,Governor Lorenzo Nolasco Maldonado,Peru,,,,,,,,,Shining Path (SL),,,,0,20,NA,NA,NA,Firearms,,,,Pistol,1,NA,0,NA,0,NA,,NA,,0,NA,NA,NA,0,NA,NA,,,NA,,
177835,2017,8,11,Pakistan,South Asia,Karachi,24.891115,67.143311,"08/11/2017: Assailants opened fire on the vehicle of Muhammad Hanif Khan near Liaquat Ali Khan Chowk in Azizabad neighborhood, Karachi, Pakistan. At least two people, including Khan, a Pakistan Traffic Police deputy superintendent, and his driver, were killed in the assault. Ansar al-Sharia (Pakistan) claimed responsibility for the attack.",0,0,1,0,Assassination,,,Police,Pakistan Traffic Police,Vehicle of Deputy Superintendent: Muhammad Hanif Khan,Pakistan,,,,,,,,,Ansar al-Sharia (Pakistan),,,Ansar al-Sharia (Pakistan) claimed responsibility for the incident and stated that the attack was carried out in retaliation for the alleged torture of detained armed group members by the military.,0,2,0,NA,NA,Firearms,,,,Multiple 9-mm pistols were used in the attack.,2,0,0,0,1,3,Minor (likely < $1 million),-99,A vehicle was damaged in this attack.,0,NA,NA,NA,NA,NA,NA,,,NA,,
168864,2016,11,4,Libya,Middle East & North Africa,Benghazi,32.069286,20.151144,"11/04/2016: An explosive device planted in the vehicle of Salah Al-Atewish detonated in Sidi Faraj neighborhood, Benghazi, Libya. At least four people, including Al-Atewish, the Magharba Tribe head, were injured in the blast. No group claimed responsibility for the attack.",0,0,0,0,Assassination,,,Private Citizens & Property,Not Applicable,Magharba Tribe Head: Salah Al-Atewish,Libya,,,,,,,,,Unknown,,,"The specific motive is unknown; however, sources noted that Salah Al-Atewish had recently assisted the military in taking over strategic oil ports.",0,-99,0,NA,NA,Explosives,,,,,0,0,4,0,1,3,Minor (likely < $1 million),-99,A vehicle was damaged in this attack.,0,NA,NA,NA,NA,NA,NA,,,NA,,
122221,2013,10,14,Afghanistan,South Asia,Gardez,33.598633,69.228996,"10/14/2013: A suicide bomber detonated his explosives at a hospital in Gardez city, Paktia province, Afghanistan. This was one of two incidents involving this assailant on this day. The assailant had been taken to the hospital after he was injured in an earlier attempted attack. Only the assailant was killed and there were no other reported casualties resulting from this incident. No group claimed responsibility for the attacks.",0,1,1,1,Bombing/Explosion,,,Business,Unknown,Hospital,Afghanistan,,,,,,,,,Unknown,,,,0,1,0,NA,NA,Explosives,,,,,1,1,0,0,1,3,Minor (likely < $1 million),-99,A hospital was damaged in this attack.,0,NA,NA,NA,NA,NA,NA,,,NA,,
70012,2000,1,28,Yugoslavia,Eastern Europe,Surcin,44.795541,20.284861,"1/28/2000: Petar Panic, a long-time security advisor for Vojislav Seselj (the chairman of the Serbian Radical Party), was shot several times and critically wounded near his home in Surcin, a suburb of Belgrade, Yugoslavia.  The assailant, who fled after the attack, was identified as Ljubimir Jovanovic.  Unofficial sources state that the attack took place in the home of Sinisa Mitrovic, following an argument.",1,0,1,0,Armed Assault,,,Government (General),Civilian,"Petar Panic, the security advisor for Vojislav Seselj",Yugoslavia,,,,,,,,,Gunmen,,,"Specific motive is unknown, but the victim was the security advisor for the chairman of the Serbian Radical Party and both had been known for their outspoken controversial views and practices.  In addition, the attack happened approximately two weeks after Zeljko Raznatovic (alias Arkan) was killed.  Sources speculate this might have been a revenge killing, since Arkan and the chairman were opponents.",0,1,0,NA,NA,Firearms,,,,,0,0,1,0,0,NA,,NA,,0,NA,NA,NA,NA,NA,NA,,,NA,,
141384,2014,12,8,Bosnia-Herzegovina,Eastern Europe,Trnovi,45.183961,15.828342,"12/08/2014: Assailants stabbed Selvedin Beganovic in Trnovi village, Federation of Bosnia and Herzegovina, Bosnia-Herzegovina. Beganovic, an imam, was injured in the attack. No group claimed responsibility for the incident; however, sources attributed the attack to Muslim Fundamentalists.",0,0,0,0,Assassination,,,Religious Figures/Institutions,Unknown,Imam: Selvedin Beganovic,Bosnia-Herzegovina,,,,,,,,,Muslim extremists,,,"The specific motive is unknown; however, sources noted that Selvedin Beganovic was critical of Muslim extremists.",0,1,0,NA,NA,Melee,,,,,0,0,1,0,0,NA,,NA,,0,NA,NA,NA,NA,NA,NA,,,NA,,
103844,2011,11,7,India,South Asia,Valajangi,18.475168,82.427445,"11/7/2011: A group of Maoists attacked a road building site near Valajangi village, Andhra Pradesh state, India.  The assailants set fire to a large earth-moving machine that had been used for laying the road.  The contractor of the building site had been warned by the Maoists to halt the project; when he refused to do so, they attacked the equipment.",0,0,1,0,Facility/Infrastructure Attack,,,Business,A road building project,Earth moving equipment at a road building site near Valajangi,India,,,,,,,,,Maoists,,,"The assailants warned the victim to halt the road building project; when he failed to do so, they set his equipment on fire.",0,-99,0,NA,NA,Incendiary,,,,Machinery was set on fire,0,0,0,0,1,4,Unknown,NA,A large earth-moving machine was set on fire,0,NA,NA,NA,NA,NA,NA,,,NA,,
159133,2016,2,19,Philippines,Southeast Asia,Iba,8.090201,125.323546,"02/19/2016: Assailants attempted to plant an explosive device in Iba village, Bukidnon province, Philippines. A clash ensued after military personnel responded to the bombing attempt. The assailants sustained an unknown number of casualties in the clash. No group claimed responsibility for the incident; however, sources attributed the attempted attack to the New People's Army (NPA).",0,0,0,0,Bombing/Explosion,Armed Assault,,Unknown,Unknown,Unknown,Philippines,,,,,,,,,New People's Army (NPA),,,,0,8,0,NA,NA,Explosives,Firearms,,,Firearms and a homemade explosive device were used in the attack.,NA,NA,NA,NA,0,NA,,NA,,0,NA,NA,NA,NA,NA,NA,,,NA,,
