,iyear,imonth,iday,country_txt,region_txt,city,latitude,longitude,summary,doubtterr,multiple,success,suicide,attacktype1_txt,attacktype2_txt,attacktype3_txt,targtype1_txt,corp1,target1,natlty1_txt,targtype2_txt,corp2,target2,natlty2_txt,targtype3_txt,corp3,target3,natlty3_txt,gname,gname2,gname3,motive,individual,nperps,nperpcap,claim2,claim3,weaptype1_txt,weaptype2_txt,weaptype3_txt,weaptype4_txt,weapdetail,nkill,nkillter,nwound,nwoundte,property,propextent,propextent_txt,propvalue,propcomment,ishostkid,nhostkid,nhours,ndays,ransom,ransomamt,ransompaid,ransomnote,hostkidoutcome_txt,nreleased,,
47842,1991,8,22,Croatia,Eastern Europe,Sisak,45.476023,16.368001,,0,0,1,0,Armed Assault,,,Police,Croatian Police,Unit,Yugoslavia,,,,,,,,,Serbian guerrillas,,,,0,NA,NA,NA,NA,Firearms,,,,Automatic firearm,8,NA,20,NA,1,NA,,NA,,0,NA,NA,NA,0,NA,NA,,,NA,,
126922,2014,2,5,Yemen,Middle East & North Africa,Aden,12.825647,44.846416,"02/05/2014: Assailants hijacked the Akhbar El Youm newspaper delivery vehicle in Aden city, Adan governorate, Yemen. No casualties were reported. No group claimed responsibility for the incident.",0,0,1,0,Hijacking,,,Journalists & Media,Akhbar El Youm Newspaper,Delivery Vehicle,Yemen,,,,,,,,,Unknown,,,,0,-99,0,NA,NA,Firearms,,,,,0,0,0,0,-9,NA,,NA,It is unknown if a bus was damaged in this attack.,0,NA,NA,NA,NA,NA,NA,,,NA,,
59910,1995,7,24,Guatemala,Central America & Caribbean,Guatemala City,14.622869,-90.529068,,0,0,1,0,Armed Assault,,,Educational Institution,Government,San Carlos University,Guatemala,,,,,,,,,Guatemalan National Revolutionary Unity (URNG),,,,0,30,NA,NA,NA,Firearms,,,,Firearm,0,NA,0,NA,1,NA,,NA,,0,NA,NA,NA,0,NA,NA,,,NA,,
4586,1977,3,9,United Kingdom,Western Europe,Caledon,54.351322,-6.837455,,1,0,1,0,Assassination,,,Military,Ulster Defence Regiment,"John Reid, Protestant",Northern Ireland,,,,,,,,,Irish Republican Army (IRA),,,,0,NA,NA,NA,NA,Firearms,,,,Firearm,1,NA,NA,NA,0,NA,,NA,,0,NA,NA,NA,0,NA,NA,,,NA,,
124686,2013,12,16,Yemen,Middle East & North Africa,Sanaa,15.325443,44.211895,"12/16/2013: Assailants attempted to abduct the son of the head media representative for the Al-Islah Party in Sanaa city, Amanat Al-Asimah governorate, Yemen. The victim was able to stave off the attempt. No group claimed responsibility for the attack.",0,0,0,0,Hostage Taking (Kidnapping),,,Private Citizens & Property,Islamic Reform Group (Islah),Son of Media Office Head,Yemen,,,,,,,,,Unknown,,,,0,-99,0,NA,NA,Unknown,,,,,0,0,0,0,0,NA,,NA,,0,NA,NA,NA,NA,NA,NA,,,NA,,
49681,1992,1,4,United Kingdom,Western Europe,Blackpool,53.814165,-3.053514,,1,0,0,0,Bombing/Explosion,,,Military,military,Weston Barracks,Great Britain,,,,,,,,,Irish Republican Army (IRA),,,,0,NA,NA,NA,NA,Explosives,,,,Explosive,0,NA,0,NA,1,NA,,NA,,0,NA,NA,NA,0,NA,NA,,,NA,,
117219,2013,5,17,Iraq,Middle East & North Africa,Baghdad,33.303566,44.371773,"05/17/2013: An explosive device detonated outside the home of a Sunni member of parliament in Al-Jamia area, Baghdad city, Baghdad governorate, Iraq. Two bodyguards were injured in the blast. No group claimed responsibility for the incident.",0,0,0,0,Assassination,,,Government (General),Council of Representatives of Iraq,Residence of Member: Ahmed al-Massari,Iraq,,,,,,,,,Unknown,,,"The specific motive is unknown; however, sources noted that the incident occurred amid a recent wave of sectarian violence between Iraq's minority Sunni and majority Shia communities.",0,-99,0,NA,NA,Explosives,,,,Explosives were used in the attack.,0,0,2,0,1,3,Minor (likely < $1 million),-99,A civilian home was damaged in this attack.,0,NA,NA,NA,NA,NA,NA,,,NA,,
147046,2015,4,20,Turkey,Middle East & North Africa,Aritis,38.347285,36.819234,"04/20/2015: An assailant stabbed Suca Gennem in Pinarbasi neighborhood, Aritis town, Kahramanmaras province, Turkey. Gennem, a Syrian teacher, was killed in the assault. The Islamic State of Iraq and the Levant (ISIL) claimed responsibility for the attack and stated that Gennem was killed because the group believed he was a spy.",0,0,1,0,Armed Assault,,,Educational Institution,Unknown,Teacher: Suca Gennem,Syria,,,,,,,,,Islamic State of Iraq and the Levant (ISIL),,,The Islamic State of Iraq and the Levant (ISIL) claimed responsibility for the incident and stated that Suca Gennem was targeted because ISIL believed he was a spy.,0,-99,0,NA,NA,Melee,,,,,1,0,0,0,0,NA,,NA,,0,NA,NA,NA,NA,NA,NA,,,NA,,
104842,2012,1,3,Pakistan,South Asia,Dera Bugti,29.034412,69.158661,"01/03/2012: A gas pipeline was blown up in Dera Bugti district, Balochistan province, Pakistan. The pipeline was damaged, and a fire started where the explosive device detonated. No group claimed responsibility for the attack.",0,0,1,0,Bombing/Explosion,,,Utilities,Unknown,Gas Pipeline,Pakistan,,,,,,,,,Unknown,,,,0,-99,0,NA,NA,Explosives,,,,,0,0,0,0,1,4,Unknown,-99,A gas pipeline was damaged in this attack.,0,NA,NA,NA,NA,NA,NA,,,NA,,
144134,2015,2,8,Ukraine,Eastern Europe,Debaltseve,48.346134,38.424828,"02/08/2015: Assailants fired projectiles that landed and detonated in Debaltseve city, Donetsk oblast, Ukraine. Seven people were killed between this and an unrelated attack in Avdiivka city on February 8, 2015. The Donetsk People's Republic claimed responsibility for the incident.",0,0,1,0,Bombing/Explosion,,,Private Citizens & Property,Debaltseve Town,Town,Ukraine,,,,,,,,,Donetsk People's Republic,,,,0,-99,0,NA,NA,Explosives,,,,Artillery was used in the attack.,4,0,NA,0,-9,NA,,NA,It is unknown if any property was damaged in this attack.,0,NA,NA,NA,NA,NA,NA,,,NA,,
168703,2016,10,30,Somalia,Sub-Saharan Africa,Goof Gaduud,3.312293,43.47213,"10/30/2016: Assailants attacked a military base in Goof Gaduud, Bay, Somalia. At least eight assailants and four soldiers were killed while three assailants and seven soldiers were injured in the ensuing clash. Al-Shabaab claimed responsibility for the incident.",1,0,1,0,Armed Assault,,,Military,Somali Armed Forces (SAF),Base,Somalia,,,,,,,,,Al-Shabaab,,,,0,-99,0,NA,NA,Explosives,Firearms,,,Rocket-propelled grenades (RPGs) and AK-47 assault rifles were used in the attack.,12,8,10,3,1,3,Minor (likely < $1 million),-99,Houses were damaged in this attack.,0,NA,NA,NA,NA,NA,NA,,,NA,,
86889,2008,5,14,Spain,Western Europe,Leon,42.599876,-5.571752,"05/14/2008: On Wednesday, an improvised explosive device, a letter bomb, detonated and wounded the civilian at an architect's office who opened it in Leon, Castilla y Leon, Spain.  No group claimed responsibility.",0,0,1,0,Bombing/Explosion,,,Business,,An architect's office,Spain,,,,,,,,,Unknown,,,The specific motive for the attack is unknown.,0,-99,0,NA,NA,Explosives,,,,An improvised explosive device was used in the attack.,0,0,1,0,-9,4,Unknown,NA,It Is unknown if the attack caused any property damage.,0,NA,NA,NA,NA,NA,NA,,,NA,,
117374,2013,5,21,Iraq,Middle East & North Africa,Abu Ghraib,33.31065,44.038208,"05/21/2013: An explosive device detonated at a police observation post in Abu Ghraib city, Baghdad governorate, Iraq. Four police officers were injured in the blast. No group claimed responsibility for the incident.",0,0,1,0,Bombing/Explosion,,,Police,Iraqi Police Service (IPS),Post,Iraq,,,,,,,,,Unknown,,,,0,-99,0,NA,NA,Explosives,,,,,0,0,4,0,1,3,Minor (likely < $1 million),-99,An observation post was damaged in this attack.,0,NA,NA,NA,NA,NA,NA,,,NA,,
123271,2013,11,11,Yemen,Middle East & North Africa,Radaa district,14.416667,44.833333,"11/11/2013: An explosive device detonated near a stationary shop in Ahram area, Rada district, Bayda governorate, Yemen. Two people were wounded by the blast. No group claimed responsibility for the incident.",0,0,1,0,Bombing/Explosion,,,Business,Unknown,Stationery shop,Yemen,,,,,,,,,Unknown,,,,0,-99,0,NA,NA,Explosives,,,,,0,0,2,0,1,3,Minor (likely < $1 million),-99,A stationary shop was damaged in this attack.,0,NA,NA,NA,NA,NA,NA,,,NA,,
20491,1983,12,15,South Africa,Sub-Saharan Africa,Johannesburg,-26.184113,28.033232,,0,0,1,0,Bombing/Explosion,,,Government (General),,Office of Department of Community Development,South Africa,,,,,,,,,African National Congress (South Africa),,,,0,NA,NA,NA,NA,Explosives,,,,Explosive,0,NA,0,NA,1,NA,,NA,,0,NA,NA,NA,0,NA,NA,,,NA,,
153798,2015,10,4,India,South Asia,Bande,19.927524,80.563288,"10/04/2015: A 10-kilogram explosive device was discovered and defused in Bande area, Kanker district, Chhattisgarh state, India. This was one of two similar incidents that occurred in Kanker on the same date. No group claimed responsibility for the incidents.",0,1,0,0,Bombing/Explosion,,,Unknown,Unknown,Unknown,India,,,,,,,,,Unknown,,,,0,-99,0,NA,NA,Explosives,,,,A 10-kilogram explosive device was used in the attack.,0,0,0,0,0,NA,,NA,,0,NA,NA,NA,NA,NA,NA,,,NA,,
174037,2017,4,19,Thailand,Southeast Asia,Poryoh,6.385287,101.701136,"04/19/2017: Assailants threw a grenade at a Territorial Defense Volunteers (TDV) base in Poryoh, Narathiwat, Thailand. There were no reported casualties in the blast. This was one of 21 coordinated attacks across southern Thailand on this date. No group claimed responsibility for the incidents.",0,1,1,0,Bombing/Explosion,,,Police,Territorial Defense Volunteers (TDV),Base,Thailand,,,,,,,,,Unknown,,,,0,-99,0,NA,NA,Explosives,,,,,0,0,0,0,-9,NA,,NA,,0,NA,NA,NA,NA,NA,NA,,,NA,,
117126,2013,5,14,Iraq,Middle East & North Africa,Baghdad,33.303566,44.371773,"05/14/2013: Gunmen attacked a row of liquor stores in Zayona district, Baghdad city, Baghdad governorate, Iraq. At least 12 people were killed and another three people were injured in the attack. No group claimed responsibility for the incident; however, sources speculate that Muslim fundamentalists were involved.",0,0,1,0,Armed Assault,,,Business,Unknown,Liquor Stores,Iraq,,,,,,,,,Muslim extremists,,,"The specific motive is unknown; however, sources noted that the attack targeted liquor stores and that Muslim fundamentalists consider alcohol forbidden by Islam.",0,-99,0,NA,NA,Firearms,"Vehicle (not to include vehicle-borne explosives, i.e., car or truck bombs)",,,Multiple suppressed firearms and four SUVs were used in the attack .,12,0,3,0,0,NA,,NA,,0,NA,NA,NA,NA,NA,NA,,,NA,,
24683,1985,3,27,United Kingdom,Western Europe,Belfast,54.607712,-5.95621,,1,0,1,0,Bombing/Explosion,,,Military,,British Army Patrol,Great Britain,,,,,,,,,Irish Republican Army (IRA),,,,0,NA,NA,NA,NA,Firearms,Explosives,,,Automatic firearm, Explosive,1,NA,0,NA,1,NA,,NA,,0,NA,NA,NA,0,NA,NA,,,NA,
126655,2014,1,31,Iraq,Middle East & North Africa,Baghdad,33.303566,44.371773,"01/31/2014: Assailants fired three rockets at the Baghdad International Airport in Baghdad city, Baghdad governorate, Iraq. There were damages to the runway and a plane, but no casualties were reported. No group claimed responsibility for the attack.",0,0,1,0,Bombing/Explosion,,,Airports & Aircraft,Baghdad International Airport,Airport,Iraq,,,,,,,,,Unknown,,,,0,-99,0,NA,NA,Explosives,,,,Rockets were used in the attack.,0,0,0,0,1,4,Unknown,-99,A plane and the runway were damaged in this attack.,0,NA,NA,NA,NA,NA,NA,,,NA,,
155541,2015,11,16,Afghanistan,South Asia,Panjshir Naw,34.718299,70.735816,"11/16/2015: A roadside landmine detonated prematurely as assailants were planting it in Panjshir Naw area, Kunar province, Afghanistan. Three assailants were killed in the blast. No group claimed responsibility for the incident; however, sources attributed the attempted attack to the Taliban.",0,0,1,0,Bombing/Explosion,,,Unknown,Unknown,Unknown,,,,,,,,,,Taliban,,,,0,3,0,NA,NA,Explosives,,,,A roadside landmine was used in the attack.,3,3,0,0,0,NA,,NA,,0,NA,NA,NA,NA,NA,NA,,,NA,,
11069,1980,6,1,Bolivia,South America,La Paz,-16.509317,-68.10434,,-9,0,1,0,Unknown,,,Private Citizens & Property,,"Undisclosed site, uninhabited area (haven't pinpointed exact area)",Bolivia,,,,,,,,,Unknown,,,,0,NA,NA,NA,NA,Unknown,,,,,0,NA,0,NA,1,4,Unknown,NA,,0,NA,NA,NA,0,NA,NA,,,NA,,
14289,1981,9,2,Lesotho,Sub-Saharan Africa,Maseru,-29.310013,27.480083,,0,0,1,0,Bombing/Explosion,,,Airports & Aircraft,,Leabua Jonathan Airport,Lesotho,,,,,,,,,Lesotho Liberation Army (LLA),,,,0,NA,NA,NA,NA,Explosives,,,,Explosive,0,NA,0,NA,1,NA,,NA,,0,NA,NA,NA,0,NA,NA,,,NA,,
93210,2009,8,13,Iraq,Middle East & North Africa,Baqubah,33.74324,44.623825,"08/13/2009: On Thursday, in the Al Jahiza area south of Ba'qubah, Diyala, Iraq, a suicide bomber detonated an improvised explosive device he was wearing near a group of Sufi Muslims. The explosion killed only the suicide bomber. No group has claimed responsibility.",0,0,1,1,Bombing/Explosion,,,Private Citizens & Property,,A group of Sufi Muslims,Iraq,,,,,,,,,Unknown,,,The specific motive for the attack is unknown.,0,-99,0,NA,NA,Explosives,,,,A suicide improvised explosive device was used in the attack.,1,1,0,0,0,NA,,NA,,0,NA,NA,NA,NA,NA,NA,,,NA,,
173997,2017,4,18,Iraq,Middle East & North Africa,Anah,34.367733,41.985275,"04/18/2017: Security forces intercepted and killed an assailant driving an explosives-laden vehicle in Anah, Al Anbar, Iraq. No group claimed responsibility for the incident.",0,0,0,0,Bombing/Explosion,,,Unknown,Unknown,Unknown,Iraq,,,,,,,,,Unknown,,,,0,-99,0,NA,NA,Explosives,,,,,1,1,0,0,0,NA,,NA,,0,NA,NA,NA,NA,NA,NA,,,NA,,
5369,1977,10,8,Spain,Western Europe,Bilbao,43.258434,-2.921819,,0,0,1,0,Assassination,,,Government (General),"Vizcaya govt, civil guard","Augusto Unceta-Barrenechea, head of Vizcaya Provincial Delegation and two g",Spain,,,,,,,,,Basque Fatherland and Freedom (ETA),,,,0,NA,NA,NA,NA,Firearms,Firearms,,,Automatic firearms, Pistol,3,NA,0,NA,0,NA,,NA,,0,NA,NA,NA,0,NA,NA,,,NA,
58557,1995,2,24,Jordan,Middle East & North Africa,Petra,30.322047,35.478358,,0,0,1,0,Armed Assault,,,Government (Diplomatic),,French Diplomat,France,,,,,,,,,Islamic Renewal Movement,,,,0,2,NA,NA,NA,Firearms,,,,Firearm,0,NA,1,NA,0,NA,,NA,,0,NA,NA,NA,0,NA,NA,,,NA,,
8829,1979,7,1,Israel,Middle East & North Africa,Tel Aviv,32.08297,34.811886,,-9,0,1,0,Bombing/Explosion,,,Business,,slaughter house,Israel,,,,,,,,,Unknown,,,,0,NA,NA,NA,NA,Explosives,,,,Explosive,NA,NA,NA,NA,1,4,Unknown,NA,,0,NA,NA,NA,0,NA,NA,,,NA,,
122691,2013,10,27,Bangladesh,South Asia,Unknown,NA,NA,10/27/2013: Two explosive devices detonated outside of the Election Commission office in Bangladesh. There were no casualties reported in the blasts. No group claimed responsibility for the incident.,0,0,1,0,Bombing/Explosion,,,Government (General),Election Commission of Bangladesh,Office,Bangladesh,,,,,,,,,Unknown,,,,0,-99,0,NA,NA,Explosives,,,,Two crude bombs were used in the attack.,0,0,0,0,-9,NA,,NA,It is unknown if any property was damaged in this attack.,0,NA,NA,NA,NA,NA,NA,,,NA,,
55988,1994,4,18,Germany,Western Europe,Gottingen,51.532605,9.928442,,-9,0,1,0,Armed Assault,,,Private Citizens & Property,Unkonwn,Israel National,Israel,,,,,,,,,Neo-Nazi extremists,,,,0,NA,NA,NA,NA,Melee,,,,Axe,0,NA,1,NA,0,NA,,NA,,0,NA,NA,NA,0,NA,NA,,,NA,,
177856,2017,8,12,Pakistan,South Asia,Quetta,30.200819,66.994354,"08/12/2017: A suicide bomber riding a motorcycle detonated near a Frontier Corps (FC) vehicle at the Pishin Stop in Quetta, Balochistan, Pakistan. In addition to the assailant, at least 15 people, including eight soldiers and seven civilians, were killed and 25 other people, including 10 soldiers and 15 civilians, were injured in the blast. The Khorasan Chapter of the Islamic State claimed responsibility for the attack.",0,0,1,1,Bombing/Explosion,,,Military,Frontier Corps (FC),Vehicle,Pakistan,Private Citizens & Property,Not Applicable,Civilians,Pakistan,,,,,Khorasan Chapter of the Islamic State,,,"The specific motive is unknown; however, authorities suspected that the attack was intended to disrupt the festivities of Pakistan's seventieth anniversary of independence.",0,1,0,NA,NA,Explosives,,,,An explosives-laden vest containing between 20 and 30 kilograms of explosives was used in the attack.,16,1,25,0,1,3,Minor (likely < $1 million),-99,Unspecified property was damaged in this attack.,0,NA,NA,NA,NA,NA,NA,,,NA,,
122863,2013,10,30,Iraq,Middle East & North Africa,Fallujah,33.349159,43.784199,"10/30/2013: Assailants opened fire on a police patrol in Fallujah city, Al Anbar governorate, Iraq. One police officer was killed and two others were injured in the attack. No group claimed responsibility for the incident.",0,0,1,0,Armed Assault,,,Police,Iraqi Police Service (IPS),Patrol,Iraq,,,,,,,,,Unknown,,,,0,-99,0,NA,NA,Firearms,,,,,1,0,2,0,0,NA,,NA,,0,NA,NA,NA,NA,NA,NA,,,NA,,
49381,1991,12,8,Philippines,Southeast Asia,Unknown,NA,NA,,0,0,1,0,Armed Assault,,,Police,Police,Jeep,Philippines,,,,,,,,,New People's Army (NPA),,,,0,NA,NA,NA,NA,Firearms,,,,Automatic firearm,5,NA,0,NA,1,NA,,NA,,0,NA,NA,NA,0,NA,NA,,,NA,,
121706,2013,9,30,Iraq,Middle East & North Africa,Baghdad,33.303566,44.371773,"09/30/2013: An explosives-laden vehicle detonated in Ghazaliyah neighborhood, Baghdad city, Baghdad governorate, Iraq. At least one person was killed and 12 others were injured in the blast. This was one of 15 coordinated car bombings in and around Baghdad on the same day. Islamic State of Iraq and the Levant (ISIL) claimed responsibility and stated that the attack was in retaliation for intensified security operations in predominantly Sunni areas.",0,1,1,0,Bombing/Explosion,,,Private Citizens & Property,Not Applicable,Civilians,Iraq,,,,,,,,,Islamic State of Iraq and the Levant (ISIL),,,Islamic State of Iraq and the Levant (ISIL) claimed responsibility and stated that this and other coordinated bombings in Baghdad were in retaliation for intensified security  operations against insurgents in Sunni areas.,0,-99,0,NA,NA,Explosives,,,,,1,0,12,0,0,NA,,NA,,0,NA,NA,NA,NA,NA,NA,,,NA,,
83989,2007,8,10,Israel,Middle East & North Africa,Jerusalem,31.784838,35.224613,"08/10/2007: In Jerusalem's Old City's Christian Quarter, Israel, an Arab looking man grabbed a pistol from a security guard and shot him in the shoulder.  Nine other people were injured from his gunshots.  The gunmen was shot dead by another guard while attempting to flee the scene.  No group claimed responsibility.",0,0,1,0,Armed Assault,,,Police,Unknown,Unknown,Israel,,,,,,,,,Unknown,,,Unknown,0,1,0,NA,NA,Firearms,,,,,2,1,9,0,0,NA,,NA,,0,NA,NA,NA,NA,NA,NA,,,NA,,
51248,1992,5,2,Afghanistan,South Asia,Kabul,34.516895,69.147011,,0,0,1,0,Hostage Taking (Barricade Incident),,,Government (General),Govt.,Former Chief Justice Karim Shardan,Afghanistan,,,,,,,,,Unknown,,,,0,3,NA,NA,NA,Firearms,,,,Pistol,1,NA,0,NA,0,NA,,NA,,1,1,0,1,0,NA,NA,,Hostage(s) killed (not during rescue attempt),0,,
175486,2017,6,2,Cameroon,Sub-Saharan Africa,Kolofata,11.162543,14.013976,"06/02/2017: Two young suicide bombers detonated at a refugee camp in Kolofata, Extreme-North, Cameroon. In addition to the two assailants, at least nine people were killed and 30 other people were injured in the blasts. No group claimed responsibility; however, sources attributed the attack to Boko Haram.",0,0,1,1,Bombing/Explosion,,,Private Citizens & Property,Unknown,Refugee Camp,Cameroon,,,,,,,,,Boko Haram,,,,0,2,0,NA,NA,Explosives,,,,,11,2,30,0,-9,NA,,NA,,0,NA,NA,NA,NA,NA,NA,,,NA,,
111709,2012,10,18,Afghanistan,South Asia,Khaki Safed district,32.677851,61.981391,"10/18/2012: Assailants opened fire on a teacher in Khak-e-Sufaid district, Farah province, Afghanistan. The teacher was killed in the attack. No group claimed responsibility for the incident; however, authorities attributed it to the Taliban.",0,0,1,0,Armed Assault,,,Educational Institution,Not Applicable,Teacher,Afghanistan,,,,,,,,,Taliban,,,,0,-99,0,NA,NA,Firearms,,,,,1,0,0,0,0,NA,,NA,,0,NA,NA,NA,NA,NA,NA,,,NA,,
46716,1991,6,7,Guatemala,Central America & Caribbean,Guatemala City,14.622869,-90.529068,,0,0,1,0,Bombing/Explosion,,,Telecommunication,Telephone Co.,Telephone Junction Box,Guatemala,,,,,,,,,Unknown,,,,0,NA,NA,NA,NA,Explosives,,,,Explosive,0,NA,0,NA,1,3,Minor (likely < $1 million),3000,,0,NA,NA,NA,0,NA,NA,,,NA,,
5752,1978,1,4,Italy,Western Europe,Rome,41.890961,12.490069,,0,0,1,0,Facility/Infrastructure Attack,,,Journalists & Media,Corriere Della Sera (Evening Courier),"offices, Rome daily paper",Italy,,,,,,,,,Armed Revolutionary Nuclei (NAR),,,,0,5,NA,NA,NA,Incendiary,Incendiary,,,Molotov cocktail,NA,NA,1,NA,1,3,Minor (likely < $1 million),60000,,1,1,NA,NA,0,NA,NA,,Hostage(s) released by perpetrators,1,,
12848,1981,2,6,El Salvador,Central America & Caribbean,Apopa,13.79833,-89.17889,,-9,0,1,0,Facility/Infrastructure Attack,,,Transportation,,Bus,El Salvador,,,,,,,,,Unknown,,,,0,NA,NA,NA,NA,Incendiary,,,,Incendiary,NA,NA,NA,NA,1,3,Minor (likely < $1 million),30000,,0,NA,NA,NA,0,NA,NA,,,NA,,
90988,2009,3,9,Pakistan,South Asia,Wana,32.306099,69.579956,"03/09/2009: On Monday, the bodies of three men were found in Wana, South Waziristan, Federally Administered Tribal Areas, Pakistan. The bodies were covered with bullet wounds. There were DVDs with the bodies stating that the men were killed for being US spies along with footage of the men's spying. Tahir Khan was kidnapped on 02/28/2009. It is unknown when and where the other men were taken hostage. The Taliban claimed responsibility.",0,0,1,0,Armed Assault,Hostage Taking (Kidnapping),,Private Citizens & Property,,The specific target was three civilians,Pakistan,,,,,,,,,Tehrik-i-Taliban Pakistan (TTP),,,The motive of the attack was that the men were accused spies for the United States.,0,-99,0,NA,NA,Firearms,,,,Unknown firearms were used in the attack.,3,0,0,0,0,NA,,NA,No property damage was reported.,1,3,NA,-99,0,NA,NA,,Hostage(s) killed (not during rescue attempt),0,,
72265,2001,5,10,West Bank and Gaza Strip,Middle East & North Africa,Unknown,31.385633,34.373045,"05/10/2001: Two Romanian men were killed and one was wounded when a bomb exploded near the security fence they were fixing near the border crossing area of Kissufim, Gaza Strip.  There were no reports of physical damage to the area.  A phone call placed anonymously after the incident claimed that the Hezbollah Palestine movement were behind the attack, saying that this was one more attack in the Palestinian uprising against Israel.",0,0,1,0,Bombing/Explosion,,,Business,Immigrant workers,Three Romanian immigrant men working,Romania,,,,,,,,,Hezbollah Palestine,,,The anonymous caller claimed that this was another attack by the Hizballah Palestine organization in a continuation of the Palestinian uprising against Israel.,0,-99,0,NA,NA,Explosives,,,,The bomb went off near the security fence.,2,0,1,0,0,NA,,NA,,0,NA,NA,NA,NA,NA,NA,,,NA,,
71250,2000,10,20,United States,North America,Phoenix,33.44826,-112.075774,"10/20/2000: Arson was set to a luxury home under construction near the Phoenix Mountain Preserve in Phoenix, Arizona in the United States, causing significant damage.  There were no casualties in the incident, and the monetary extent of property damage is unknown.  The incident was claimed by the Coalition to Save the Preserves (CSP) in opposition of building and development in the preserved mountain area.  This incident was one in a series of 11 luxury home arsons in the Phoenix area between April 2000 and January 2001.  In June 2001, confessed eco-terrorist Mark Warren Sands was indicted for eight of the arson incidents, pled guilty, and in 2002, was sentenced to 18 years in prison for torching seven luxury homes under construction.  In this particular incident, the victims were homeowners Mario and Melanie Lio, and this was the second time his luxury home was burned after being rebuilt.  The first incident was in April of the same year (40900).",1,0,1,0,Facility/Infrastructure Attack,,,Private Citizens & Property,private luxury residence under construction,"private home of Mario and Melanie Lio, which was under construction in the Phoenix mountain preserve area in AZ",United States,,,,,,,,,Coalition to Save the Preserves (CSP),,,Allegedly in opposition of housing sprawl in the Phoenix Desert Mountain Preserve,0,1,1,NA,NA,Incendiary,,,,,0,0,0,0,1,4,Unknown,NA,"collectively, all eight arsons caused an estimated $5 million in damages",0,NA,NA,NA,0,NA,NA,,,NA,,
